<?xml version="1.0" encoding="utf-8"?><!-- Notices - Distribution Notice: 
           This document has been approved for Public Release and is available for use without restriction.
       --><cve:CVE xmlns:cve="urn:us:gov:ic:cve" xmlns:ism="urn:us:gov:ic:ism" xmlns:xsi="http://www.w3.org/2001/XMLSchema-instance" ism:compliesWith="USGov USIC" ism:ownerProducer="USA" ism:classification="U" ism:DESVersion="201609.201707" ism:ISMCATCESVersion="201609" ism:resourceElement="true" CVEVersion="2.1" specVersion="201609.201707" ism:createDate="2012-01-04" xsi:schemaLocation="urn:us:gov:ic:cve ../CveSchema/CVEXml.xsd">


	  <cve:IRM>
		    <URN xmlns="urn:us:gov:ic:cve">urn:us:gov:ic:cvenum:ism:dissem</URN>
		    <Title xmlns="urn:us:gov:ic:cve" ism:ownerProducer="USA" ism:classification="U">CVEnumISMDissem</Title>
	  	<Description xmlns="urn:us:gov:ic:cve" ism:ownerProducer="USA" ism:classification="U">All currently valid Dissemination controls from the published register. This CVE is used by @ism:disseminationControls.</Description>
		    <cve:Created>2012-01-04T00:14:00-04:00</cve:Created>
		    <Source ism:classification="U" ism:ownerProducer="USA" xmlns="urn:us:gov:ic:cve">IC Systems Register and Manual</Source>
		    <PointOfContact ism:classification="U" ism:ownerProducer="USA" xmlns="urn:us:gov:ic:cve">
         <Name>Office IC CIO</Name>
         <Email>ic-standards-support@iarpa.gov</Email>
      </PointOfContact>
	  </cve:IRM>
	
	  <cve:Enumeration multivalue="true" ism:ownerProducer="USA" ism:classification="U">
		    <Term xmlns="urn:us:gov:ic:cve" ism:classification="U" ism:ownerProducer="USA">
			      <Value ism:classification="U" ism:ownerProducer="USA">RS</Value>
			      <Description ism:classification="U" ism:ownerProducer="USA">RISK SENSITIVE</Description>
		    </Term>
		    <Term xmlns="urn:us:gov:ic:cve" ism:classification="U" ism:ownerProducer="USA">
			      <Value ism:classification="U" ism:ownerProducer="USA">FOUO</Value>
			      <Description ism:classification="U" ism:ownerProducer="USA">FOR OFFICIAL USE ONLY</Description>
		    </Term>
		    <Term xmlns="urn:us:gov:ic:cve" ism:classification="U" ism:ownerProducer="USA">
			      <Value ism:classification="U" ism:ownerProducer="USA">OC</Value>
			      <Description ism:classification="U" ism:ownerProducer="USA">ORIGINATOR CONTROLLED</Description>
		    </Term>
		  	<Term xmlns="urn:us:gov:ic:cve" ism:classification="U" ism:ownerProducer="USA">
		  		   <Value ism:classification="U" ism:ownerProducer="USA">OC-USGOV</Value>
		  		   <Description ism:classification="U" ism:ownerProducer="USA">ORIGINATOR CONTROLLED US GOVERNMENT</Description>
		  	</Term>
		    <Term xmlns="urn:us:gov:ic:cve" ism:classification="U" ism:ownerProducer="USA">
			      <Value ism:classification="U" ism:ownerProducer="USA">IMC</Value>
			      <Description ism:classification="U" ism:ownerProducer="USA">CONTROLLED IMAGERY</Description>
		    </Term>
		    <Term xmlns="urn:us:gov:ic:cve" ism:classification="U" ism:ownerProducer="USA">
			      <Value ism:classification="U" ism:ownerProducer="USA">NF</Value>
			      <Description ism:classification="U" ism:ownerProducer="USA">NOT RELEASABLE TO FOREIGN NATIONALS</Description>
		    </Term>
		    <Term xmlns="urn:us:gov:ic:cve" ism:classification="U" ism:ownerProducer="USA">
			      <Value ism:classification="U" ism:ownerProducer="USA">PR</Value>
			      <Description ism:classification="U" ism:ownerProducer="USA">CAUTION-PROPRIETARY INFORMATION INVOLVED</Description>
		    </Term>
		    <Term xmlns="urn:us:gov:ic:cve" ism:classification="U" ism:ownerProducer="USA">
			      <Value ism:classification="U" ism:ownerProducer="USA">REL</Value>
			      <Description ism:classification="U" ism:ownerProducer="USA">AUTHORIZED FOR RELEASE TO</Description>
		    </Term>
		    <Term xmlns="urn:us:gov:ic:cve" ism:classification="U" ism:ownerProducer="USA">
			      <Value ism:classification="U" ism:ownerProducer="USA">RELIDO</Value>
			      <Description ism:classification="U" ism:ownerProducer="USA">RELEASABLE BY INFORMATION DISCLOSURE OFFICIAL</Description>
		    </Term>
	  	  <Term xmlns="urn:us:gov:ic:cve" ism:classification="U" ism:ownerProducer="USA" deprecated="2017-11-01">
			      <Value ism:classification="U" ism:ownerProducer="USA">EYES</Value>
			      <Description ism:classification="U" ism:ownerProducer="USA">EYES ONLY</Description>
		    </Term>
		    <Term xmlns="urn:us:gov:ic:cve" ism:classification="U" ism:ownerProducer="USA">
			      <Value ism:classification="U" ism:ownerProducer="USA">DSEN</Value>
			      <Description ism:classification="U" ism:ownerProducer="USA">DEA SENSITIVE</Description>
		    </Term>
		    <Term xmlns="urn:us:gov:ic:cve" ism:classification="U" ism:ownerProducer="USA">
			      <Value ism:classification="U" ism:ownerProducer="USA">FISA</Value>
			      <Description ism:classification="U" ism:ownerProducer="USA">FOREIGN INTELLIGENCE SURVEILLANCE ACT</Description>
		    </Term>
		    <Term xmlns="urn:us:gov:ic:cve" ism:classification="U" ism:ownerProducer="USA">
			      <Value ism:classification="U" ism:ownerProducer="USA">DISPLAYONLY</Value>
			      <Description ism:classification="U" ism:ownerProducer="USA">AUTHORIZED FOR DISPLAY BUT NOT RELEASE TO</Description>
		    </Term>
	  </cve:Enumeration>
</cve:CVE>