<?xml version="1.0" encoding="utf-8"?><!-- Notices - Distribution Notice: 
           This document has been approved for Public Release and is available for use without restriction.
       --><cve:CVE xmlns:cve="urn:us:gov:ic:cve" xmlns:ism="urn:us:gov:ic:ism" xmlns:xsi="http://www.w3.org/2001/XMLSchema-instance" ism:compliesWith="USGov USIC" ism:ownerProducer="USA" ism:classification="U" ism:DESVersion="201609.201707" ism:ISMCATCESVersion="201609" ism:resourceElement="true" CVEVersion="2.1" specVersion="201609.201707" ism:createDate="2012-01-04" xsi:schemaLocation="urn:us:gov:ic:cve ../CveSchema/CVEXml.xsd">
	
	  <cve:IRM>
		    <URN xmlns="urn:us:gov:ic:cve">urn:us:gov:ic:cvenum:ism:nonic</URN>
		    <Title xmlns="urn:us:gov:ic:cve" ism:ownerProducer="USA" ism:classification="U">CVEnumISMNonIC</Title>
	  	<Description xmlns="urn:us:gov:ic:cve" ism:ownerProducer="USA" ism:classification="U">All currently valid Non-IC markings from the published register. This CVE is used by @ism:nonICmarkings.</Description>
		
		    <cve:Created>2012-01-04T00:14:00-04:00</cve:Created>
		
		    <Source ism:classification="U" ism:ownerProducer="USA" xmlns="urn:us:gov:ic:cve">IC Systems Register and Manual</Source>
		    <PointOfContact ism:classification="U" ism:ownerProducer="USA" xmlns="urn:us:gov:ic:cve">
         <Name>Office IC CIO</Name>
         <Email>ic-standards-support@iarpa.gov</Email>
      </PointOfContact>
	  </cve:IRM>
	
	  <cve:Enumeration multivalue="true" ism:ownerProducer="USA" ism:classification="U">
		
		    <Term xmlns="urn:us:gov:ic:cve" ism:classification="U" ism:ownerProducer="USA">
			      <Value ism:classification="U" ism:ownerProducer="USA">DS</Value>
			      <Description ism:classification="U" ism:ownerProducer="USA">LIMITED DISTRIBUTION</Description>
		    </Term>
	  		<!--	  	
		    <Term xmlns="urn:us:gov:ic:cve" ism:classification="U" ism:ownerProducer="USA">
			      <Value ism:classification="U" ism:ownerProducer="USA" regularExpression="true">ACCM-[A-Z0-9\-_]{1,61}</Value>
			      <Description ism:classification="U" ism:ownerProducer="USA">The name of the ALTERNATE COMPENSATORY CONTROL MEASURE, substituting "_" for a space.</Description>
		    </Term>
			-->		
		    <Term xmlns="urn:us:gov:ic:cve" ism:classification="U" ism:ownerProducer="USA">
			      <Value ism:classification="U" ism:ownerProducer="USA">XD</Value>
			      <Description ism:classification="U" ism:ownerProducer="USA">EXCLUSIVE DISTRIBUTION</Description>
		    </Term>
		    <Term xmlns="urn:us:gov:ic:cve" ism:classification="U" ism:ownerProducer="USA">
			      <Value ism:classification="U" ism:ownerProducer="USA">ND</Value>
			      <Description ism:classification="U" ism:ownerProducer="USA">NO DISTRIBUTION</Description>
		    </Term>
		    <Term xmlns="urn:us:gov:ic:cve" ism:classification="U" ism:ownerProducer="USA">
			      <Value ism:classification="U" ism:ownerProducer="USA">SBU</Value>
			      <Description ism:classification="U" ism:ownerProducer="USA">SENSITIVE BUT UNCLASSIFIED</Description>
		    </Term>
		    <Term xmlns="urn:us:gov:ic:cve" ism:classification="U" ism:ownerProducer="USA">
			      <Value ism:classification="U" ism:ownerProducer="USA">SBU-NF</Value>
			      <Description ism:classification="U" ism:ownerProducer="USA">SENSITIVE BUT UNCLASSIFIED NOFORN</Description>
		    </Term>
		    <Term xmlns="urn:us:gov:ic:cve" ism:classification="U" ism:ownerProducer="USA">
			      <Value ism:classification="U" ism:ownerProducer="USA">LES</Value>
			      <Description ism:classification="U" ism:ownerProducer="USA">LAW ENFORCEMENT SENSITIVE</Description>
		    </Term>
		    <Term xmlns="urn:us:gov:ic:cve" ism:classification="U" ism:ownerProducer="USA">
			      <Value ism:classification="U" ism:ownerProducer="USA">LES-NF</Value>
			      <Description ism:classification="U" ism:ownerProducer="USA">LAW ENFORCEMENT SENSITIVE NOFORN</Description>
		    </Term>
		    <Term xmlns="urn:us:gov:ic:cve" ism:classification="U" ism:ownerProducer="USA">
			      <Value ism:classification="U" ism:ownerProducer="USA">SSI</Value>
			      <Description ism:classification="U" ism:ownerProducer="USA">SENSITIVE SECURITY INFORMATION</Description>
		    </Term>    
		    <Term xmlns="urn:us:gov:ic:cve" ism:classification="U" ism:ownerProducer="USA">
			      <Value ism:classification="U" ism:ownerProducer="USA">NNPI</Value>
			      <Description ism:classification="U" ism:ownerProducer="USA">NAVAL NUCLEAR PROPULSION INFORMATION</Description>
		    </Term>
	  </cve:Enumeration> 
</cve:CVE>