<?xml version="1.0" encoding="utf-8"?><!-- Notices - Distribution Notice: 
           This document has been approved for Public Release and is available for use without restriction.
       --><cve:CVE xmlns:cve="urn:us:gov:ic:cve" xmlns:ism="urn:us:gov:ic:ism" xmlns:xsi="http://www.w3.org/2001/XMLSchema-instance" ism:compliesWith="USGov USIC" ism:ownerProducer="USA" ism:classification="U" ism:DESVersion="201609.201707" ism:ISMCATCESVersion="201609" ism:resourceElement="true" CVEVersion="2.1" specVersion="201609.201707" ism:createDate="2011-09-01" xsi:schemaLocation="urn:us:gov:ic:cve ../CveSchema/CVEXml.xsd">

	  <cve:IRM>
		    <URN xmlns="urn:us:gov:ic:cve">urn:us:gov:ic:cvenum:ism:exemptfrom</URN>
		    <Title xmlns="urn:us:gov:ic:cve" ism:ownerProducer="USA" ism:classification="U">CVEnumISMExemptFrom</Title>
		    <Description xmlns="urn:us:gov:ic:cve" ism:ownerProducer="USA" ism:classification="U">Current rule set names that documents may comply
		    	with. This CVE is used by @ism:exemptFrom.</Description>

		    <cve:Created>2010-05-30T16:52:00-04:00</cve:Created>

		    <Source ism:classification="U" ism:ownerProducer="USA" xmlns="urn:us:gov:ic:cve">ISM schema</Source>
		    <PointOfContact ism:classification="U" ism:ownerProducer="USA" xmlns="urn:us:gov:ic:cve">
         <Name>Office IC CIO</Name>
         <Email>ic-standards-support@iarpa.gov</Email>
      </PointOfContact>
	  </cve:IRM>

	  <cve:Enumeration multivalue="true" ism:ownerProducer="USA" ism:classification="U">
		    <Term xmlns="urn:us:gov:ic:cve" ism:classification="U" ism:ownerProducer="USA">
			      <Value ism:classification="U" ism:ownerProducer="USA">IC_710_MANDATORY_FDR</Value>
			      <Description ism:classification="U" ism:ownerProducer="USA">Document claims exemption from ICD-710 rules mandating the
				use of Foreign Disclosure and Release markings that have been encoded in ISM.
				Currently, the requirement for FD&amp;R is only mandatory for Disseminated Analytic
				Product; however, it is strongly encouraged otherwise.</Description>
		    </Term>
		    <Term xmlns="urn:us:gov:ic:cve" ism:classification="U" ism:ownerProducer="USA">
			      <Value ism:classification="U" ism:ownerProducer="USA">DOD_DISTRO_STATEMENT</Value>
			      <Description ism:classification="U" ism:ownerProducer="USA">Document claims exemption from the rules in DoD5230.24
				requiring DoD Distribution Statements that have been encoded into
				ISM.</Description>
		    </Term>
	  </cve:Enumeration>

</cve:CVE>