<?xml version="1.0" encoding="utf-8"?><cve:CVE xmlns:cve="urn:us:gov:ic:cve" xmlns:ism="urn:us:gov:ic:ism" xmlns:xsi="http://www.w3.org/2001/XMLSchema-instance" ism:compliesWith="USGov USIC" ism:ownerProducer="USA" ism:classification="U" ism:DESVersion="201609.201707" ism:ISMCATCESVersion="201609" ism:resourceElement="true" CVEVersion="2.1" specVersion="201609.201707" ism:createDate="2011-09-01" xsi:schemaLocation="urn:us:gov:ic:cve ../CveSchema/CVEXml.xsd">

   <cve:IRM>
      <URN xmlns="urn:us:gov:ic:cve">urn:us:gov:ic:cvenum:ism:classification:all</URN>
      <Title xmlns="urn:us:gov:ic:cve" ism:ownerProducer="USA" ism:classification="U">CVEnumISMClassificationAll</Title>
      <Description xmlns="urn:us:gov:ic:cve" ism:ownerProducer="USA" ism:classification="U">All currently valid classification marks. This CVE is used by @ism:classification.</Description>
      <cve:Created>2010-05-31T21:22:00-04:00</cve:Created>
      <Source ism:classification="U" ism:ownerProducer="USA" xmlns="urn:us:gov:ic:cve">IC Systems Register and Manual</Source>
      <PointOfContact ism:classification="U" ism:ownerProducer="USA" xmlns="urn:us:gov:ic:cve">
         <Name>Office IC CIO</Name>
         <Email>ic-standards-support@iarpa.gov</Email>
      </PointOfContact>
   </cve:IRM>

   <cve:Enumeration multivalue="false" ism:ownerProducer="USA" ism:classification="U">
      <Term xmlns="urn:us:gov:ic:cve" ism:classification="U" ism:ownerProducer="USA">
         <Value ism:classification="U" ism:ownerProducer="USA">R</Value>
         <Description ism:classification="U" ism:ownerProducer="USA">RESTRICTED</Description>
      </Term>
      <Term xmlns="urn:us:gov:ic:cve" ism:classification="U" ism:ownerProducer="USA">
         <Value ism:classification="U" ism:ownerProducer="USA">C</Value>
         <Description ism:classification="U" ism:ownerProducer="USA">CONFIDENTIAL</Description>
      </Term>
      <Term xmlns="urn:us:gov:ic:cve" ism:classification="U" ism:ownerProducer="USA">
         <Value ism:classification="U" ism:ownerProducer="USA">S</Value>
         <Description ism:classification="U" ism:ownerProducer="USA">SECRET</Description>
      </Term>
      <Term xmlns="urn:us:gov:ic:cve" ism:classification="U" ism:ownerProducer="USA">
         <Value ism:classification="U" ism:ownerProducer="USA">TS</Value>
         <Description ism:classification="U" ism:ownerProducer="USA">TOP SECRET</Description>
      </Term>
      <Term xmlns="urn:us:gov:ic:cve" ism:classification="U" ism:ownerProducer="USA">
         <Value ism:classification="U" ism:ownerProducer="USA">U</Value>
         <Description ism:classification="U" ism:ownerProducer="USA">UNCLASSIFIED</Description>
      </Term>
   </cve:Enumeration>
</cve:CVE>