<?xml version="1.0" encoding="utf-8"?>
<?xml-model href="../../Schematron/ISM/ISM_XML.sch" type="application/xml" schematypens="http://purl.oclc.org/dsdl/schematron"?>
<!-- Notices - Distribution Notice: 
           This document has been approved for Public Release and is available for use without restriction.
       -->
<cve:CVE xmlns:cve="urn:us:gov:ic:cve" xmlns:ism="urn:us:gov:ic:ism"
	xmlns:xsi="http://www.w3.org/2001/XMLSchema-instance" 
	ism:compliesWith="USGov USIC" ism:ownerProducer="USA" ism:classification="U" ism:DESVersion="201609.201707"
	ism:ISMCATCESVersion="201609" ism:resourceElement="true" CVEVersion="2.1" specVersion="201705"
	ism:createDate="2013-11-15"
	xsi:schemaLocation="urn:us:gov:ic:cve ../CveSchema/CVEXml.xsd">

	<cve:IRM>
		<URN xmlns="urn:us:gov:ic:cve">urn:us:gov:ic:cvenum:mn:region</URN>
		<Title xmlns="urn:us:gov:ic:cve" ism:ownerProducer="USA" ism:classification="U">CVEnumMNRegion</Title>
		<Description xmlns="urn:us:gov:ic:cve" ism:ownerProducer="USA" ism:classification="U">All 
			currently identified values for Region. This list was originally derived from the 
		    GIMMEE Mission Need Region list.</Description>

		<cve:Created>2015-06-03</cve:Created>

		<Source ism:classification="U" ism:ownerProducer="USA" xmlns="urn:us:gov:ic:cve">IC-CIO</Source>
		<PointOfContact ism:classification="U" ism:ownerProducer="USA" xmlns="urn:us:gov:ic:cve">
			<Name>Office IC CIO</Name>
			<Email>ic-standards-support@iarpa.gov</Email>
		</PointOfContact>
	</cve:IRM>

	<cve:Enumeration multivalue="false" ism:ownerProducer="USA" ism:classification="U">
		<Term xmlns="urn:us:gov:ic:cve" ism:classification="U" ism:ownerProducer="USA">
			<Value ism:classification="U" ism:ownerProducer="USA">AFce</Value>
			<Description ism:classification="U" ism:ownerProducer="USA">Africa, Central</Description>
		</Term>
		<Term xmlns="urn:us:gov:ic:cve" ism:classification="U" ism:ownerProducer="USA">
			<Value ism:classification="U" ism:ownerProducer="USA">AFea</Value>
			<Description ism:classification="U" ism:ownerProducer="USA">Africa, East</Description>
		</Term>
		<Term xmlns="urn:us:gov:ic:cve" ism:classification="U" ism:ownerProducer="USA">
			<Value ism:classification="U" ism:ownerProducer="USA">AFno</Value>
			<Description ism:classification="U" ism:ownerProducer="USA">Africa, North</Description>
		</Term>
		<Term xmlns="urn:us:gov:ic:cve" ism:classification="U" ism:ownerProducer="USA">
			<Value ism:classification="U" ism:ownerProducer="USA">AFso</Value>
			<Description ism:classification="U" ism:ownerProducer="USA">Africa, Southern</Description>
		</Term>
		<Term xmlns="urn:us:gov:ic:cve" ism:classification="U" ism:ownerProducer="USA">
			<Value ism:classification="U" ism:ownerProducer="USA">AFwe</Value>
			<Description ism:classification="U" ism:ownerProducer="USA">Africa, West</Description>
		</Term>
		<Term xmlns="urn:us:gov:ic:cve" ism:classification="U" ism:ownerProducer="USA">
			<Value ism:classification="U" ism:ownerProducer="USA">AMca</Value>
			<Description ism:classification="U" ism:ownerProducer="USA">Americas, Caribbean</Description>
		</Term>
		<Term xmlns="urn:us:gov:ic:cve" ism:classification="U" ism:ownerProducer="USA">
			<Value ism:classification="U" ism:ownerProducer="USA">AMce</Value>
			<Description ism:classification="U" ism:ownerProducer="USA">Americas, Central</Description>
		</Term>
		<Term xmlns="urn:us:gov:ic:cve" ism:classification="U" ism:ownerProducer="USA">
			<Value ism:classification="U" ism:ownerProducer="USA">AMno</Value>
			<Description ism:classification="U" ism:ownerProducer="USA">Americas, North</Description>
		</Term>
		<Term xmlns="urn:us:gov:ic:cve" ism:classification="U" ism:ownerProducer="USA">
			<Value ism:classification="U" ism:ownerProducer="USA">AMso</Value>
			<Description ism:classification="U" ism:ownerProducer="USA">Americas, South</Description>
		</Term>
		<Term xmlns="urn:us:gov:ic:cve" ism:classification="U" ism:ownerProducer="USA">
			<Value ism:classification="U" ism:ownerProducer="USA">AMan</Value>
			<Description ism:classification="U" ism:ownerProducer="USA">Americas, Antarctica</Description>
		</Term>
		<Term xmlns="urn:us:gov:ic:cve" ism:classification="U" ism:ownerProducer="USA">
			<Value ism:classification="U" ism:ownerProducer="USA">ASea</Value>
			<Description ism:classification="U" ism:ownerProducer="USA">Asia, East</Description>
		</Term>
		<Term xmlns="urn:us:gov:ic:cve" ism:classification="U" ism:ownerProducer="USA">
			<Value ism:classification="U" ism:ownerProducer="USA">ASse</Value>
			<Description ism:classification="U" ism:ownerProducer="USA">Asia, South East</Description>
		</Term>
		<Term xmlns="urn:us:gov:ic:cve" ism:classification="U" ism:ownerProducer="USA">
			<Value ism:classification="U" ism:ownerProducer="USA">ASso</Value>
			<Description ism:classification="U" ism:ownerProducer="USA">Asia, South</Description>
		</Term>
		<Term xmlns="urn:us:gov:ic:cve" ism:classification="U" ism:ownerProducer="USA">
			<Value ism:classification="U" ism:ownerProducer="USA">EAca</Value>
			<Description ism:classification="U" ism:ownerProducer="USA">Eurasia, Caucasus</Description>
		</Term>
		<Term xmlns="urn:us:gov:ic:cve" ism:classification="U" ism:ownerProducer="USA">
			<Value ism:classification="U" ism:ownerProducer="USA">EAce</Value>
			<Description ism:classification="U" ism:ownerProducer="USA">Eurasia, Central</Description>
		</Term>
		<Term xmlns="urn:us:gov:ic:cve" ism:classification="U" ism:ownerProducer="USA">
			<Value ism:classification="U" ism:ownerProducer="USA">EAru</Value>
			<Description ism:classification="U" ism:ownerProducer="USA">Eurasia, Russia</Description>
		</Term>
		<Term xmlns="urn:us:gov:ic:cve" ism:classification="U" ism:ownerProducer="USA">
			<Value ism:classification="U" ism:ownerProducer="USA">EUba</Value>
			<Description ism:classification="U" ism:ownerProducer="USA">Europe, Balkans</Description>
		</Term>
		<Term xmlns="urn:us:gov:ic:cve" ism:classification="U" ism:ownerProducer="USA">
			<Value ism:classification="U" ism:ownerProducer="USA">EUce</Value>
			<Description ism:classification="U" ism:ownerProducer="USA">Europe, Central</Description>
		</Term>
		<Term xmlns="urn:us:gov:ic:cve" ism:classification="U" ism:ownerProducer="USA">
			<Value ism:classification="U" ism:ownerProducer="USA">EUno</Value>
			<Description ism:classification="U" ism:ownerProducer="USA">Europe, North</Description>
		</Term>
		<Term xmlns="urn:us:gov:ic:cve" ism:classification="U" ism:ownerProducer="USA">
			<Value ism:classification="U" ism:ownerProducer="USA">EUso</Value>
			<Description ism:classification="U" ism:ownerProducer="USA">Europe, South</Description>
		</Term>
		<Term xmlns="urn:us:gov:ic:cve" ism:classification="U" ism:ownerProducer="USA">
			<Value ism:classification="U" ism:ownerProducer="USA">MEme</Value>
			<Description ism:classification="U" ism:ownerProducer="USA">Middle East</Description>
		</Term>
		<Term xmlns="urn:us:gov:ic:cve" ism:classification="U" ism:ownerProducer="USA">
			<Value ism:classification="U" ism:ownerProducer="USA">OCoc</Value>
			<Description ism:classification="U" ism:ownerProducer="USA">Oceania</Description>
		</Term>
	</cve:Enumeration>
</cve:CVE>
