<?xml version="1.0" encoding="utf-8"?><!-- Notices - Distribution Notice: 
           This document has been approved for Public Release and is available for use without restriction.
       --><cve:CVE xmlns:cve="urn:us:gov:ic:cve" xmlns:ism="urn:us:gov:ic:ism" xmlns:xsi="http://www.w3.org/2001/XMLSchema-instance" ism:compliesWith="USGov USIC" ism:ownerProducer="USA" ism:classification="U" ism:DESVersion="201609.201707" ism:ISMCATCESVersion="201609" ism:resourceElement="true" CVEVersion="2.1" specVersion="201609.201707" ism:createDate="2011-09-01" xsi:schemaLocation="urn:us:gov:ic:cve ../CveSchema/CVEXml.xsd">

    <cve:IRM>
        <URN xmlns="urn:us:gov:ic:cve">urn:us:gov:ic:cvenum:ism:sar</URN>
        <Title xmlns="urn:us:gov:ic:cve" ism:ownerProducer="USA" ism:classification="U">CVEnumISMSAR</Title>
        <Description xmlns="urn:us:gov:ic:cve" ism:ownerProducer="USA" ism:classification="U">All currently valid SAR controls from the published register. This CVE is used by @ism:SARIdentifier.</Description>

        <cve:Created>2010-03-12T11:29:00-04:00</cve:Created>

        <Source ism:classification="U" ism:ownerProducer="USA" xmlns="urn:us:gov:ic:cve">IC Systems Register and Manual</Source>
        <PointOfContact ism:classification="U" ism:ownerProducer="USA" xmlns="urn:us:gov:ic:cve">
         <Name>Office IC CIO</Name>
         <Email>ic-standards-support@iarpa.gov</Email>
      </PointOfContact>
    </cve:IRM>

    <cve:Enumeration multivalue="true" ism:ownerProducer="USA" ism:classification="U">
 <!--       
        <Term xmlns="urn:us:gov:ic:cve"
            ism:classification="U"
            ism:ownerProducer="USA">
            <Value ism:classification="U"
                ism:ownerProducer="USA"
                regularExpression="true">[A-Z_0-9\-]{1,100}</Value>
            <Description ism:classification="U" ism:ownerProducer="USA">SPECIAL ACCESS REQUIRED-XXX,Within the nickname or name of a SAR all spaces must be replaced with a "_". The XSL will restore the spaces for rendering.</Description>
        </Term>
        <Term xmlns="urn:us:gov:ic:cve"
            ism:classification="U"
            ism:ownerProducer="USA">
            <Value ism:classification="U"
                ism:ownerProducer="USA"
                regularExpression="true">[A-Z]{2,}</Value>
            <Description ism:classification="U" ism:ownerProducer="USA">SPECIAL ACCESS REQUIRED-XXX, the Digraph or Trigraph of the SAR is represented by the XXX</Description>
        </Term>
        <Term xmlns="urn:us:gov:ic:cve"
            ism:classification="U"
            ism:ownerProducer="USA">
            <Value ism:classification="U"
                ism:ownerProducer="USA"
                regularExpression="true">[A-Z]{2,}-[A-Z][A-Z0-9]+</Value>
            <Description ism:classification="U" ism:ownerProducer="USA">SPECIAL ACCESS REQUIRED-XXX, the Digraph or Trigraph of the SAR is represented by the XXX</Description>
        </Term>
        <Term xmlns="urn:us:gov:ic:cve"
            ism:classification="U"
            ism:ownerProducer="USA">
            <Value ism:classification="U"
                ism:ownerProducer="USA"
                regularExpression="true">[A-Z]{2,}-[A-Z][A-Z0-9]+-[A-Z0-9]{2,}</Value>
            <Description ism:classification="U" ism:ownerProducer="USA">SPECIAL ACCESS REQUIRED-XXX, the Digraph or Trigraph of the SAR is represented by the XXX</Description>
        </Term>
-->
    </cve:Enumeration>

</cve:CVE>